{
  "$schema": "http://json-schema.org/draft-07/schema#",
  "$id": "https://gridpulse.example/schemas/events/v1/envelope.schema.json",
  "title": "GridPulse event envelope v1",
  "description": "Fields common to every GridPulse event. Per-type schemas extend this with a const event_type and a typed payload.",
  "type": "object",
  "additionalProperties": false,
  "required": [
    "event_id", "schema_version", "event_type", "source", "series", "region",
    "valid_from", "valid_to", "settlement_date", "settlement_period",
    "issued_at", "ingested_at", "payload"
  ],
  "properties": {
    "event_id": {
      "description": "UUIDv5 over '{source}|{event_type}|{series}|{region}|{valid_from}|{issued_at or empty}' in the GridPulse namespace (ADR-0004).",
      "type": "string",
      "pattern": "^[0-9a-f]{8}-[0-9a-f]{4}-5[0-9a-f]{3}-[89ab][0-9a-f]{3}-[0-9a-f]{12}$"
    },
    "schema_version": {
      "description": "Semantic version of the schema this event was written with. Major version is fixed by the folder (v1).",
      "type": "string",
      "pattern": "^1\\.(0|[1-9][0-9]*)\\.(0|[1-9][0-9]*)$"
    },
    "event_type": {
      "type": "string",
      "enum": ["carbon_intensity", "generation_mix", "demand", "demand_forecast", "system_price", "weather"]
    },
    "source": {
      "type": "string",
      "enum": ["neso-carbon-intensity", "elexon-insights", "neso-data-portal", "open-meteo"]
    },
    "series": {
      "description": "Distinguishes multiple series of one event type from one source, e.g. 'indo' vs 'itsdo', or a weather location id.",
      "type": "string",
      "pattern": "^[a-z0-9]+(-[a-z0-9]+)*$",
      "maxLength": 64
    },
    "region": { "$ref": "#/definitions/region" },
    "valid_from": { "$ref": "#/definitions/utcTimestamp" },
    "valid_to": { "$ref": "#/definitions/utcTimestamp" },
    "settlement_date": {
      "description": "UK settlement date (local calendar date). Null for data not aligned to settlement periods, e.g. hourly weather.",
      "type": ["string", "null"],
      "pattern": "^[0-9]{4}-[0-9]{2}-[0-9]{2}$"
    },
    "settlement_period": {
      "description": "1-based half-hour within the settlement date: 48 on normal days, 46 when clocks go forward, 50 when they go back.",
      "type": ["integer", "null"],
      "minimum": 1,
      "maximum": 50
    },
    "issued_at": {
      "description": "When a forecast was issued. Null for actuals/observations. Part of the event identity, so each forecast revision is kept.",
      "oneOf": [{ "$ref": "#/definitions/utcTimestamp" }, { "type": "null" }]
    },
    "ingested_at": {
      "description": "When GridPulse fetched the record. Not part of the identity.",
      "type": "string",
      "pattern": "^[0-9]{4}-[0-9]{2}-[0-9]{2}T[0-9]{2}:[0-9]{2}:[0-9]{2}(\\.[0-9]{1,9})?Z$"
    },
    "payload": { "type": "object" }
  },
  "definitions": {
    "utcTimestamp": {
      "description": "Canonical UTC instant, second precision, 'Z' suffix. Canonical so every language derives identical event_ids.",
      "type": "string",
      "pattern": "^[0-9]{4}-[0-9]{2}-[0-9]{2}T[0-9]{2}:[0-9]{2}:[0-9]{2}Z$",
      "format": "date-time"
    },
    "region": {
      "description": "'GB' for national data, otherwise a Carbon Intensity API region (DNO areas and nations), as a stable slug. Also the Kafka partition key.",
      "type": "string",
      "enum": [
        "GB",
        "north-scotland", "south-scotland", "north-west-england", "north-east-england", "yorkshire",
        "north-wales-merseyside", "south-wales", "west-midlands", "east-midlands", "east-england",
        "south-west-england", "south-england", "london", "south-east-england",
        "england", "scotland", "wales"
      ]
    },
    "nonNegativeNumberOrNull": { "type": ["number", "null"], "minimum": 0 }
  }
}
